{
  "topic": "Trí tuệ nhân tạo (AI)",
  "topic_id": "ai",
  "level": 2,
  "grade_target": "Lớp 2 · Tiểu học",
  "reward_purple_meteors": 14,
  "count": 25,
  "questions": [
    {
      "id": "ASTRO_AI_LV02_Q001",
      "topic": "Trí tuệ nhân tạo (AI)",
      "level": 2,
      "grade_target": "Lớp 2 · Tiểu học",
      "mascot_dialog": "Khi bạn nói với loa thông minh, giọng nói của bạn gọi là gì?",
      "question_text": "Khi bạn nói một câu hỏi cho loa thông minh, giọng nói đó được gọi là gì?",
      "options": [
        {
          "id": "A",
          "text": "Màn hình"
        },
        {
          "id": "B",
          "text": "Đầu ra (output)"
        },
        {
          "id": "C",
          "text": "Cục pin"
        },
        {
          "id": "D",
          "text": "Đầu vào (input)"
        }
      ],
      "correct_option_id": "D",
      "explanation": "Thông tin ta đưa vào máy (giọng nói, chữ, hình ảnh) gọi là 'đầu vào' (input).",
      "source_reference": "MIT OpenCourseWare – Input/Output (concept)",
      "reward_purple_meteors": 14
    },
    {
      "id": "ASTRO_AI_LV02_Q002",
      "topic": "Trí tuệ nhân tạo (AI)",
      "level": 2,
      "grade_target": "Lớp 2 · Tiểu học",
      "mascot_dialog": "Vậy câu trả lời loa nói ra thì gọi là gì?",
      "question_text": "Câu trả lời mà loa thông minh phát ra cho bạn được gọi là gì?",
      "options": [
        {
          "id": "A",
          "text": "Đầu vào (input)"
        },
        {
          "id": "B",
          "text": "Đầu ra (output)"
        },
        {
          "id": "C",
          "text": "Dây điện"
        },
        {
          "id": "D",
          "text": "Nút bấm"
        }
      ],
      "correct_option_id": "B",
      "explanation": "Kết quả máy tạo ra sau khi xử lý (câu trả lời, hình ảnh) gọi là 'đầu ra' (output).",
      "source_reference": "MIT OpenCourseWare – Input/Output (concept)",
      "reward_purple_meteors": 14
    },
    {
      "id": "ASTRO_AI_LV02_Q003",
      "topic": "Trí tuệ nhân tạo (AI)",
      "level": 2,
      "grade_target": "Lớp 2 · Tiểu học",
      "mascot_dialog": "Byte thú thật nhé: đôi khi tớ cũng đoán sai đấy!",
      "question_text": "Điều nào sau đây đúng về AI?",
      "options": [
        {
          "id": "A",
          "text": "AI đôi khi cũng mắc lỗi, không phải lúc nào cũng đúng"
        },
        {
          "id": "B",
          "text": "AI luôn luôn đúng 100%"
        },
        {
          "id": "C",
          "text": "AI không bao giờ cần dữ liệu"
        },
        {
          "id": "D",
          "text": "AI là phép thuật"
        }
      ],
      "correct_option_id": "A",
      "explanation": "AI học từ dữ liệu nên có thể đoán sai, nhất là khi gặp thứ lạ hoặc dữ liệu chưa tốt. Vì vậy con người cần kiểm tra lại.",
      "source_reference": "Khan Academy – Limitations of AI",
      "reward_purple_meteors": 14
    },
    {
      "id": "ASTRO_AI_LV02_Q004",
      "topic": "Trí tuệ nhân tạo (AI)",
      "level": 2,
      "grade_target": "Lớp 2 · Tiểu học",
      "mascot_dialog": "Quá trình cho AI học từ dữ liệu có tên riêng đấy!",
      "question_text": "Quá trình cho AI học từ nhiều ví dụ được gọi là gì?",
      "options": [
        {
          "id": "A",
          "text": "Lau màn hình"
        },
        {
          "id": "B",
          "text": "Tắt máy"
        },
        {
          "id": "C",
          "text": "Sạc pin"
        },
        {
          "id": "D",
          "text": "Huấn luyện (training)"
        }
      ],
      "correct_option_id": "D",
      "explanation": "'Huấn luyện' là quá trình đưa nhiều dữ liệu vào để AI học ra quy luật và làm tốt nhiệm vụ.",
      "source_reference": "Google AI for Education – Training a model",
      "reward_purple_meteors": 14
    },
    {
      "id": "ASTRO_AI_LV02_Q005",
      "topic": "Trí tuệ nhân tạo (AI)",
      "level": 2,
      "grade_target": "Lớp 2 · Tiểu học",
      "mascot_dialog": "Nghe giọng nói và nhìn hình ảnh là hai việc khác nhau nha!",
      "question_text": "Việc AI 'nghe và hiểu giọng nói' được gọi là gì?",
      "options": [
        {
          "id": "A",
          "text": "Chơi bóng"
        },
        {
          "id": "B",
          "text": "Nhận diện khuôn mặt"
        },
        {
          "id": "C",
          "text": "Vẽ tranh"
        },
        {
          "id": "D",
          "text": "Nhận diện giọng nói"
        }
      ],
      "correct_option_id": "D",
      "explanation": "Nhận diện giọng nói giúp máy chuyển lời nói thành chữ hoặc lệnh; khác với nhận diện khuôn mặt (xử lý hình ảnh).",
      "source_reference": "IEEE – Speech recognition (concept)",
      "reward_purple_meteors": 14
    },
    {
      "id": "ASTRO_AI_LV02_Q006",
      "topic": "Trí tuệ nhân tạo (AI)",
      "level": 2,
      "grade_target": "Lớp 2 · Tiểu học",
      "mascot_dialog": "Robot muốn hoạt động thì cần thứ này!",
      "question_text": "Robot cần gì để có thể hoạt động?",
      "options": [
        {
          "id": "A",
          "text": "Một giấc ngủ trưa"
        },
        {
          "id": "B",
          "text": "Nguồn năng lượng như pin hoặc điện"
        },
        {
          "id": "C",
          "text": "Một bữa cơm"
        },
        {
          "id": "D",
          "text": "Một cốc nước"
        }
      ],
      "correct_option_id": "B",
      "explanation": "Robot là máy móc nên cần năng lượng (pin, điện) để các bộ phận hoạt động.",
      "source_reference": "Khan Academy – How machines get power",
      "reward_purple_meteors": 14
    },
    {
      "id": "ASTRO_AI_LV02_Q007",
      "topic": "Trí tuệ nhân tạo (AI)",
      "level": 2,
      "grade_target": "Lớp 2 · Tiểu học",
      "mascot_dialog": "Có loại cảm biến biết trời sáng hay tối đó!",
      "question_text": "Cảm biến ánh sáng giúp robot biết điều gì?",
      "options": [
        {
          "id": "A",
          "text": "Bài hát tên gì"
        },
        {
          "id": "B",
          "text": "Món ăn có ngon không"
        },
        {
          "id": "C",
          "text": "Xung quanh đang sáng hay tối"
        },
        {
          "id": "D",
          "text": "Hôm nay thứ mấy"
        }
      ],
      "correct_option_id": "C",
      "explanation": "Cảm biến ánh sáng đo lượng ánh sáng, giúp thiết bị biết khi nào sáng, khi nào tối (ví dụ đèn tự bật ban đêm).",
      "source_reference": "MIT OpenCourseWare – Sensors (concept)",
      "reward_purple_meteors": 14
    },
    {
      "id": "ASTRO_AI_LV02_Q008",
      "topic": "Trí tuệ nhân tạo (AI)",
      "level": 2,
      "grade_target": "Lớp 2 · Tiểu học",
      "mascot_dialog": "Còn bộ phận nào giúp robot 'nghe' âm thanh?",
      "question_text": "Bộ phận nào giúp thiết bị 'nghe' được âm thanh?",
      "options": [
        {
          "id": "A",
          "text": "Đèn pin"
        },
        {
          "id": "B",
          "text": "Bánh xe"
        },
        {
          "id": "C",
          "text": "Micro (cảm biến âm thanh)"
        },
        {
          "id": "D",
          "text": "Cục tẩy"
        }
      ],
      "correct_option_id": "C",
      "explanation": "Micro thu âm thanh và chuyển thành tín hiệu để máy xử lý — nhờ đó loa thông minh nghe được bạn nói.",
      "source_reference": "IEEE – Microphones & audio (concept)",
      "reward_purple_meteors": 14
    },
    {
      "id": "ASTRO_AI_LV02_Q009",
      "topic": "Trí tuệ nhân tạo (AI)",
      "level": 2,
      "grade_target": "Lớp 2 · Tiểu học",
      "mascot_dialog": "AI rất giỏi tìm ra quy luật lặp đi lặp lại!",
      "question_text": "AI thường giỏi việc tìm ra điều gì trong dữ liệu?",
      "options": [
        {
          "id": "A",
          "text": "Mùi vị món ăn"
        },
        {
          "id": "B",
          "text": "Quy luật, mẫu lặp lại (pattern)"
        },
        {
          "id": "C",
          "text": "Cảm xúc thật của con người"
        },
        {
          "id": "D",
          "text": "Giấc mơ"
        }
      ],
      "correct_option_id": "B",
      "explanation": "AI rất mạnh trong việc phát hiện mẫu (pattern) lặp lại trong dữ liệu, ví dụ nhận ra chữ số hay hình dạng.",
      "source_reference": "Stanford CS – Pattern recognition (concept)",
      "reward_purple_meteors": 14
    },
    {
      "id": "ASTRO_AI_LV02_Q010",
      "topic": "Trí tuệ nhân tạo (AI)",
      "level": 2,
      "grade_target": "Lớp 2 · Tiểu học",
      "mascot_dialog": "Muốn AI học giỏi thì dữ liệu nên thế nào?",
      "question_text": "Điều gì giúp AI học tốt hơn?",
      "options": [
        {
          "id": "A",
          "text": "Không có dữ liệu nào"
        },
        {
          "id": "B",
          "text": "Có nhiều dữ liệu tốt và đúng"
        },
        {
          "id": "C",
          "text": "Chỉ một tấm ảnh duy nhất"
        },
        {
          "id": "D",
          "text": "Dữ liệu bị sai hết"
        }
      ],
      "correct_option_id": "B",
      "explanation": "Càng nhiều dữ liệu đúng và đa dạng, AI càng học được nhiều và dự đoán chính xác hơn.",
      "source_reference": "Google AI for Education – Data quality",
      "reward_purple_meteors": 14
    },
    {
      "id": "ASTRO_AI_LV02_Q011",
      "topic": "Trí tuệ nhân tạo (AI)",
      "level": 2,
      "grade_target": "Lớp 2 · Tiểu học",
      "mascot_dialog": "Byte trông vui vẻ, nhưng tớ có cảm xúc thật không nhỉ?",
      "question_text": "AI và robot có cảm xúc thật như con người không?",
      "options": [
        {
          "id": "A",
          "text": "Có, chúng biết đau"
        },
        {
          "id": "B",
          "text": "Có, chúng buồn vui y như người"
        },
        {
          "id": "C",
          "text": "Có, chúng biết yêu thương"
        },
        {
          "id": "D",
          "text": "Không, chúng chỉ bắt chước chứ không có cảm xúc thật"
        }
      ],
      "correct_option_id": "D",
      "explanation": "AI có thể bắt chước biểu cảm hay giọng điệu, nhưng không có cảm xúc thật như con người.",